<?xml version="1.0" encoding="UTF-8"?>
<cheatsheet title="Preparing narrative data" xmlns:xsi="http://www.w3.org/2001/XMLSchema-instance" xsi:noNamespaceSchemaLocation="..\contentFile.xsd">
	<intro>
		<description>In addition to geospatial data, Debrief can analyse narrative data in the form of time-stamped narrative comments.  The comments may originatr from a number of sources, but ultimately they must be stored in columns in a textual REP file.</description>
	</intro>
	<item title="Check you have some data">
		<description>In the top left hand corner of Debrief you should find the Navigator window.  If is isn't there, select "Navigator" from Debrief's Window/Show View menu.</description>
	</item>
	<item title="Check you have a workspace">
		<description>Before you can link in existing data, you need to define a project for your work.  This is a parent folder within which your links are stored.  If your Navigator window is empty, you must follow the "Generating a project" cheat-sheet accessed from the Help/Cheat Sheets menu.</description>
	</item>
	<item title="Add a new Folder">
		<description>Right-click on your current project in the Navigator view, then select 'Folder' from the 'New' sub-menu.  The New Folder wizard will open.
		</description>
	</item>
	<item title="Show the Advanced options">
		<description>Still in the New Folder Wizard, click the 'Advanced' button to display the Advanced options.</description>
	</item>
	<item title="Linking to an existing folder">
		<description>Click on the 'Link to folder in the file system', and navigate to the target folder</description>
	</item>
	<item title="Done">
		<description>Well done, there you are.  Just repeat this process to add any other data directories you want to load data from.</description>
	</item>
</cheatsheet>
